{
  "schema_version": "net.lifecycle.report.v1",
  "lifecycle_report_id": "lifecycle_report_demo_retired",
  "subject_id": "node_localhost_service_demo",
  "subject_kind": "node",
  "lifecycle_state": "retired",
  "observed_by_node_id": "node_local_process_demo",
  "reason": "Synthetic retired lifecycle report fixture.",
  "metadata": {
    "synthetic": true,
    "declared_only": true,
    "no_process_control": true,
    "note": "Retired state vocabulary only."
  },
  "observed_at_unix_ms": 0
}
