{
  "schema_version": "net.lifecycle.report.v1",
  "lifecycle_report_id": "lifecycle_report_demo_stopped",
  "subject_id": "endpoint_demo_localhost_http",
  "subject_kind": "endpoint",
  "lifecycle_state": "stopped",
  "observed_by_node_id": "node_local_process_demo",
  "reason": "Synthetic stopped lifecycle report fixture.",
  "metadata": {
    "synthetic": true,
    "declared_only": true,
    "no_process_control": true,
    "note": "Stopped state vocabulary only."
  },
  "observed_at_unix_ms": 0
}
